Tên phim,ID phim,Đạo diễn,Diễn viên chính,Thể loại phim,Thời lượng (phút),Độ phổ biến,Năm phát hành,Link Poster,Link Backdrop,Điểm đánh giá,Mô tả
Carnal Sins,73796,Madison Monroe,"Brandy Davis, Danny Pape, Anthony Skordi, McKayla Matthews, Daniel Busch","Phim Chính Kịch, Phim Lãng Mạn",90,8.5809,2001,https://image.tmdb.org/t/p/w500/px9kRZYmcz8I8O2JwIw1hoSCYXv.jpg,https://image.tmdb.org/t/p/original/8s8duqG6L0aSDo3nB8ip0nFRvxw.jpg,3.8,
Người Nhện: Vũ Trụ Mới,324857,Bob Persichetti,"Shameik Moore, Jake Johnson, Hailee Steinfeld, Mahershala Ali, Brian Tyree Henry","Phim Hoạt Hình, Phim Hành Động, Phim Phiêu Lưu, Phim Khoa Học Viễn Tưởng",117,12.2229,2018,https://image.tmdb.org/t/p/w500/kahw25SAqedXIruUGIuSUiq7t98.jpg,https://image.tmdb.org/t/p/original/8mnXR9rey5uQ08rZAvzojKWbDQS.jpg,8.396,"Sau khi bị một con nhện nhiễm xạ cắn, Miles Morales, chàng thiếu niên từ Brooklyn đã nhận được một khóa học nhanh về cách giăng tơ từ những người ở chiều không gian khác."
Cuộc Đào Tẩu Trên Không,1126166,Mel Gibson,"Mark Wahlberg, Michelle Dockery, Topher Grace, Leah Remini, Maaz Ali","Phim Hành Động, Phim Gây Cấn",91,12.4203,2025,https://image.tmdb.org/t/p/w500/pOoz9qovz41fafz1DHP5TDcl0RZ.jpg,https://image.tmdb.org/t/p/original/hwlyY7LJdEFbCPaGNXiskKKmJ5X.jpg,5.994,"Một phi công chịu trách nhiệm đưa Thống chế Không quân đến áp giải một kẻ chạy trốn về hầu tòa. Khi cả ba bay qua địa phận Alaska, căng thẳng leo thang, niềm tin bị thử thách, bởi không phải ai trên máy bay cũng như họ nghĩ."
Plank Face,418389,Scott Schirmer,"Nathan Barrett, Susan M Martin, Brigid Macaulay, Alyss Winkler, Jason Hignite",Phim Kinh Dị,91,12.6357,2016,https://image.tmdb.org/t/p/w500/shcNuFU5SLkkDyrJxIZssU3zdGu.jpg,https://image.tmdb.org/t/p/original/oGwwJbxlVfv4Q4m677yF3IJLCqw.jpg,4.842,
Deadly Match,577022,David Langlois,"Alyssa Lynch, Mitch Ainley, Tatyana Ali, Bethany Brown, Debs Howard","Phim Gây Cấn, Chương Trình Truyền Hình",83,12.404,2019,https://image.tmdb.org/t/p/w500/6zeXWypIC3YdkFb3n82pEtsI2NB.jpg,https://image.tmdb.org/t/p/original/5AwGu6V31NFZ9RHyMHLlT12qP89.jpg,5.5,
Sonnenflecken,305920,Barbara Albert,"Nina Proll, Kathrin Resetarits, Una Wipplinger, Victor Tremmel, Alexandere Tarzi",Không rõ,25,11.7717,1998,https://image.tmdb.org/t/p/w500/stXgfEuPjsOklO1hebh7pVwRKVi.jpg,,3.0,
Anaconda: Khu Rừng Nguyền Rủa,1252428,Xiang Qiuliang,"夏若妍, Doãn Tử Duy, 王星辰, Lạc Đạt Hoa, Xa Bảo La","Phim Phiêu Lưu, Phim Kinh Dị, Phim Gây Cấn",84,12.9519,2024,https://image.tmdb.org/t/p/w500/9a7URTaq1Eimlg2ZujPX9FdOeGK.jpg,https://image.tmdb.org/t/p/original/gSVk4r8Q4R8aeGY0hhEG3bE0QzL.jpg,7.15,"Bị kẹt lại trong khu rừng nhiệt đới, một nhóm nghệ sĩ xiếc phải tìm cách thoát khỏi con trăn khổng lồ ghê rợn và tên săn trộm cuồng săn có âm mưu tàn nhẫn."
Kim Cương Trong Đá,473033,Josh Safdie,"Adam Sandler, LaKeith Stanfield, Julia Fox, Kevin Garnett, Idina Menzel","Phim Chính Kịch, Phim Gây Cấn, Phim Hình Sự",136,12.6745,2019,https://image.tmdb.org/t/p/w500/buohlnZ44W9kooRa3G08xrb7MW9.jpg,https://image.tmdb.org/t/p/original/eGljNfNCrPhFYG2RXXmmE0OKu5.jpg,7.152,"Howard Ratner, một thợ kim hoàn ở thành phố New York lôi cuốn luôn tìm kiếm điểm số lớn tiếp theo, thực hiện một loạt các vụ cá cược cao có thể dẫn đến cơn gió của cả cuộc đời."
Cha Ghẻ,615177,Michael Dowse,"Ed Helms, Taraji P. Henson, Terrence Little Gardenhigh, Betty Gilpin, RonReaco Lee","Phim Hài, Phim Hành Động, Phim Hình Sự",88,11.871,2020,https://image.tmdb.org/t/p/w500/fsIIv6QKDlqrVyGGkouMah4D4ir.jpg,https://image.tmdb.org/t/p/original/9nLiA8HCZCDKPLVYJKLLVJpbVGq.jpg,5.5,"Một cảnh sát Detroit vụng về. Cậu con trai hay nói tục của bạn gái anh. Lần đầu hai người tìm cách gắn kết, nhưng rồi phải hợp tác khi phát hiện một âm mưu phạm tội."
Xứ Sở Các Nguyên Tố,976573,Peter Sohn,"Leah Lewis, Mamoudou Athie, Ronnie del Carmen, Shila Ommi, Wendi McLendon-Covey","Phim Gia Đình, Phim Giả Tượng, Phim Hài, Phim Lãng Mạn, Phim Hoạt Hình",102,13.5985,2023,https://image.tmdb.org/t/p/w500/7GaeF6xeUbfXFZCtOCWs503CJUl.jpg,https://image.tmdb.org/t/p/original/4fLZUr1e65hKPPVw0R3PmKFKxj1.jpg,7.593,"Xứ Sở Các Nguyên Tố từ Disney và Pixar lấy bối cảnh tại thành phố các các nguyên tố, nơi lửa, nước, đất và không khí cùng chung sống với nhau. Câu chuyện xoay quanh nhân vật Ember, một cô nàng cá tính, thông minh, mạnh mẽ và đầy sức hút. Tuy nhiên, mối quan hệ của cô với Wade - một anh chàng hài hước, luôn thuận thế đẩy dòng - khiến Ember cảm thấy ngờ vực với thế giới này."
Cuộc Đổ Bộ Bí Ẩn,329865,Denis Villeneuve,"Amy Adams, Jeremy Renner, Forest Whitaker, Michael Stuhlbarg, Mark O'Brien","Phim Chính Kịch, Phim Khoa Học Viễn Tưởng, Phim Bí Ẩn",116,12.9698,2016,https://image.tmdb.org/t/p/w500/fNfK7FuicJdRou0ac5jfVEFA0dd.jpg,https://image.tmdb.org/t/p/original/hNCqkXbWd40eftqSdjq8TmV7Mqr.jpg,7.622,"Khi một phi thuyền bí ẩn đáp xuống trái đất, một biệt đội tinh anh dưới sự dẫn dắt của chuyên gia ngôn ngữ học kiệt xuất Louise Banks được đưa đến để điều tra. Louise và các đồng đội phải chạy đua với thời gian để tìm câu trả lời cho nhiều bí ẩn. Để rồi, trong quá trình tìm kiếm, cô phát hiện những điều có thể đe dọa cuộc sống của cô và sự tồn tại của cả nhân loại."
Deadly Manor,128188,José Ramón Larraz,"Jennifer Delora, Kathleen Patane, Jerry Kernion, Clark Tufts, Greg Rhodes",Phim Kinh Dị,87,12.2273,1990,https://image.tmdb.org/t/p/w500/vxHRvcAvwcEAUNyaOD5OyQpIU0S.jpg,https://image.tmdb.org/t/p/original/fOnlkrTC4iKeNDZh6mY6lBGTSaE.jpg,5.1,
Dead Reckoning,463870,Andrzej Bartkowiak,"K.J. Apa, India Eisley, Sydney Park, Scott Adkins, James Remar",Phim Gây Cấn,91,11.646,2020,https://image.tmdb.org/t/p/w500/rIHwHM3m0O8escRlRyDoCEaAY7Z.jpg,https://image.tmdb.org/t/p/original/8u6jMcCebzjM18QDIS7x41CR53h.jpg,5.678,
Khai Tử Đức Tin,1200320,Ned Crowley,"Guy Pearce, DeWanda Wise, Bill Pullman, Raoul Max Trujillo, Ryan de Quintal","Phim Gây Cấn, Phim Miền Tây",108,12.4266,2025,https://image.tmdb.org/t/p/w500/bNHlTTdpdDv8xxrXF3krVghyCcj.jpg,https://image.tmdb.org/t/p/original/dC15RaDX4mmPB0omILrjTKMGy6W.jpg,3.964,"Mùa hè năm 1859, một bác sĩ góa vợ miễn cưỡng đồng ý đưa một người phụ nữ nô lệ vừa được tự do cùng đứa con gái lai da trắng bí ẩn của cô đi trong hành trình năm ngày băng qua miền Tây đẫm máu, để tìm đến một người chữa bệnh bằng đức tin ở thị trấn xa xôi. Người mẹ tin rằng con gái mình bị quỷ ám, còn vị bác sĩ cho rằng cô bé chỉ mắc một căn bệnh lạ. Nhưng dù là lời nguyền hay dịch bệnh, sự thật vẫn không thay đổi: mọi sinh vật mà cô bé chạm vào đều chết một cách bí ẩn."
Santa Maradona,56899,Marco Ponti,"Stefano Accorsi, Anita Caprioli, Libero De Rienzo, Mandala Tayde, Domenico D'Alessandro","Phim Hài, Phim Lãng Mạn, Phim Chính Kịch",96,11.2001,2001,https://image.tmdb.org/t/p/w500/fYuwnWK4TN1EVB8RiGbNps5cyBr.jpg,https://image.tmdb.org/t/p/original/ojcnSztiM3N2Bv1Jy0OVK7t5JfO.jpg,7.038,
Cleavagefield,98360,Jim Wynorski,"Rebecca Love, Amy Ried, Lucia Santos, Brandin Rackley, Tallulah Blankhead","Phim Hài, Phim Kinh Dị",77,10.722,2009,https://image.tmdb.org/t/p/w500/32YYPWUUM8BQB984CpPZLKbVako.jpg,,4.286,
The Mighty,9821,Peter Chelsom,"Sharon Stone, Elden Henson, Kieran Culkin, Gena Rowlands, Harry Dean Stanton","Phim Chính Kịch, Phim Hài",100,12.1997,1998,https://image.tmdb.org/t/p/w500/m8wJa7LVixCtgcmCJX3eg7dxgJ7.jpg,https://image.tmdb.org/t/p/original/wq41s88t8TUNDWWhpZQ65P4OhP8.jpg,7.245,
Chuộc Lại Tình Yêu,698508,D.J. Caruso,"Abigail Cowen, Tom Lewis, Eric Dane, Famke Janssen, Logan Marshall-Green","Phim Lãng Mạn, Phim Chính Kịch, Phim Miền Tây",134,11.5335,2022,https://image.tmdb.org/t/p/w500/pDc2HxQtC0MlKD4QfRvmKREEyhc.jpg,https://image.tmdb.org/t/p/original/lD8dFIk9wDEvOwZw0RB47e346io.jpg,7.844,"Giữa cơn sốt vàng California, một người nông dân phải lòng một phụ nữ xinh đẹp có quá khứ đau khổ. Liệu anh có thể giúp cô đối mặt với ác quỷ trong mình và học cách yêu?"
Butchers Book Two: Raghorn,1244039,Adrian Langley,"Nick Biskupek, Michael Swatton, Sam Huntsman, Hollie Kennedy, Corgand Janeway-Svendsen",Phim Kinh Dị,88,13.3564,2024,https://image.tmdb.org/t/p/w500/uSLYBuDTHpTAJI9vcm2brMu4J9H.jpg,https://image.tmdb.org/t/p/original/8BfXvZio7fB1FFWqB2Oz6tbi3ZX.jpg,4.684,
Ninja Sát Thủ,22832,James McTeigue,"비, Naomie Harris, Ben Miles, Rick Yune, Sho Kosugi","Phim Hành Động, Phim Phiêu Lưu, Phim Gây Cấn",99,12.2909,2009,https://image.tmdb.org/t/p/w500/mq9LDE2OYRaZcUjHHifFrpQLRoq.jpg,https://image.tmdb.org/t/p/original/44Yi72Ut3NchXewQzx814ViE2dy.jpg,6.678,"Bộ phim tập trung vào nhân vật Raizo (Rain), một trong những ninja sát thủ nguy hiểm nhất trên thế giới. Raiza thuở nhỏ là một đứa trẻ đường phố, được tổ chức Ozunu Clan, một tổ chức bí mật mà sự tồn tại của nó dường như vẫn là huyền thoại, nhận về nuôi và huấn luyện để trở thành sát thủ chuyên nghiệp. Nhưng Raizo bị ám ảnh bởi cách đối xử tàn nhẫn của tổ chức đối với bạn mình, Raizo quyết định trốn chạy và biến mất khỏi tổ chức. Raizo chờ đợi, và chuẩn bị thời cơ để trả thù.Tại Berlin, điệp vụ Mika Coretti chộp được manh mối về đường dây chuyển tiền giữa các sát thủ chuyên ám sát chính trị gia và một tổ chức sát thủ bí ẩn từ Viễn Đông. Thừa lệnh của cấp trên, Mika xâm nhập vào hệ thống tối ..."
Cô Nàng Hàng Xóm,10591,Luke Greenfield,"Emile Hirsch, Elisha Cuthbert, Timothy Olyphant, Christopher Rodriguez Marquette, Paul Dano","Phim Hài, Phim Lãng Mạn",110,12.1681,2004,https://image.tmdb.org/t/p/w500/vjmpLOk3aNzdgEpjdV5fVcfasVE.jpg,https://image.tmdb.org/t/p/original/qvcOovScPoRalRxDy50rYSYFree.jpg,6.735,"Khi Danielle chuyển đến thị trấn, nam sinh cuối cấp ba Matthew mê đắm cô nàng. Nhưng việc cô là một cựu ngôi sao phim người lớn có thể cản trở các kế hoạch lớn của cậu."
Chiến Hữu,769,Martin Scorsese,"Robert De Niro, Ray Liotta, Joe Pesci, Lorraine Bracco, Paul Sorvino","Phim Chính Kịch, Phim Hình Sự",145,13.9908,1990,https://image.tmdb.org/t/p/w500/56yHDzoWZUFLUD2ztsVzSNcHo6f.jpg,https://image.tmdb.org/t/p/original/gILte6Zd7m1YneIr6MVhh30S9pr.jpg,8.453,"Câu chuyện có thật về Henry Hill, một cậu bé Brooklyn mang nửa dòng máu Ailen, nửa Sicily, được các băng nhóm xã hội đen hàng xóm nhận nuôi khi còn nhỏ và leo lên hàng ngũ của một gia đình Mafia dưới sự hướng dẫn của Jimmy Conway."
Wonder Woman: Nữ Thần Chiến Binh,297762,Patty Jenkins,"Gal Gadot, Chris Pine, Connie Nielsen, Robin Wright, Danny Huston","Phim Hành Động, Phim Phiêu Lưu, Phim Giả Tượng",141,12.2548,2017,https://image.tmdb.org/t/p/w500/bzspyi8QqQQyztBhP2XwOAzWOSG.jpg,https://image.tmdb.org/t/p/original/AaABt75ZzfMGrscUR2seabz4PEX.jpg,7.214,"Trước khi trở thành Wonder Woman, Diana là công chúa chiến binh Amazon của hòn đảo Themyscira. Khi chàng phi công Steve Trevor trôi dạt vào đảo và kể về cuộc đại chiến đang diễn ra tại thế giới bên ngoài, Diana quyết định rời khỏi quê nhà để giải cứu nhân loại. Từ đó cô khám phá ra quyền năng và sứ mệnh thật sự của mình."
Điệp Vụ Boston,1422,Martin Scorsese,"Leonardo DiCaprio, Matt Damon, Jack Nicholson, Mark Wahlberg, Martin Sheen","Phim Chính Kịch, Phim Gây Cấn, Phim Hình Sự",151,11.8696,2006,https://image.tmdb.org/t/p/w500/nT97ifVT2J1yMQmeq20Qblg61T.jpg,https://image.tmdb.org/t/p/original/6WRrGYalXXveItfpnipYdayFkQB.jpg,8.159,"The Departed (Điệp Vụ Boston) là bộ phim được dựng lại từ siêu phẩm Vô Gian Đạo (Infernal Affairs) của Hồng Kông. Nội dung phim xoay quanh hai con người có hai lai lịch hoàn toàn khác nhau nhưng lại đi chung một con đường: làm nội gián. Billy Costigan, một cảnh sát chìm được cài vào băng nhóm tội phạm do Frank Costello cầm đầu. Cùng lúc này, nhân viên cảnh sát Colin Sullivan lại là một tay tội phạm được đưa vào nội bộ cảnh sát nhằm cung cấp tin tức cho Frank. Cả hai bước vào cuộc rượt đuổi với nhiệm vụ khai thác thông tin mật của mỗi bên, đồng thời phải che giấu thân phận thật sự của mình..."
Trò Chơi Cân Não,2649,David Fincher,"Michael Douglas, Sean Penn, Deborah Kara Unger, James Rebhorn, Peter Donat","Phim Chính Kịch, Phim Gây Cấn, Phim Bí Ẩn",129,11.8521,1997,https://image.tmdb.org/t/p/w500/4UOa079915QjiTA2u5hT2yKVgUu.jpg,https://image.tmdb.org/t/p/original/k7GM13qRYSour3lk90Dq1EwdpoW.jpg,7.6,"Bộ phim mở đầu bằng cuộc sống bận rộn hằng ngày của một ông chủ ngân hàng tại San Francisco đã khiến ông trở nên cô độc. Và cao trào của bộ phim bắt đầu khi ông được người em trai tặng một trò chơi đặc biệt – The Game, thứ đã thay đổi quan điểm của ông về cách sống và thế giới xung quanh."
Nghị Lực Cháy Bỏng,1196791,Sean McNamara,"Joel Courtney, William H. Macy, John Corbett, DeVon Franklin, Stephanie Szostak",Phim Chính Kịch,111,11.37,2025,https://image.tmdb.org/t/p/w500/iUMmG3Q0JyAuSx9QpIiMFhI5zDo.jpg,https://image.tmdb.org/t/p/original/lM88cKl8suAWniiAy8IJvfMupDk.jpg,6.7,"Từ thảm kịch thổi bùng nghị lực sống, cậu bé vùng dậy nhờ tình thân, niềm tin và cả một thành phố đứng sau lưng. Một hành trình chứng minh rằng phép màu có thật, khi cả cộng đồng cùng nâng đỡ."
Dead Fire,112229,Robert Lee,"Colin Cunningham, Monika Schnarre, Matt Frewer, C. Thomas Howell, Rachel Hayward","Phim Khoa Học Viễn Tưởng, Phim Hành Động, Phim Gây Cấn",92,11.1577,1997,https://image.tmdb.org/t/p/w500/4JlGyxhDosVdmZvslGiMh0vY4TP.jpg,,3.8,
Dead Body Man,213805,Ryan Cavalline,"Eddie Benevich, Peter Blessel, Desiree, Syn DeVil, Jessica Lynn Baum",Phim Kinh Dị,96,21.2872,2004,https://image.tmdb.org/t/p/w500/tce52pTmOHFp97c1QzKStCHPd7e.jpg,,0.0,
Félvilág,374987,Attila Szász,"Kovács Patricia, Dorka Gryllus, Laura Döbrösi, János Kulka, Péter Sándor","Chương Trình Truyền Hình, Phim Bí Ẩn, Phim Chính Kịch, Phim Lịch Sử, Phim Hình Sự",88,13.1001,2015,https://image.tmdb.org/t/p/w500/v5Z1tGkXHH2ToWOmrpMj7E6jhGe.jpg,https://image.tmdb.org/t/p/original/cvOxBnR3IP2YBIvjFGBc0NDYpg6.jpg,6.9,
Engelen,33340,Margreth Olin,"Maria Bonnevie, Antti Reini, Benjamin Helstad, Börje Ahlstedt, Gunilla Röör",Phim Chính Kịch,97,11.8805,2009,https://image.tmdb.org/t/p/w500/fnBmZ12TRQY3SEkqgdFfr6Rs1DX.jpg,https://image.tmdb.org/t/p/original/7kwgmySXj77cRnYeX8kcxtHhQOe.jpg,5.941,
Mayday,626576,Massimiliano Cerchi,"Michael Paré, Crystal Santos, Chanel Ryan, Michael Wainwright, Raj Kala","Phim Kinh Dị, Phim Giả Tượng, Phim Gây Cấn",76,12.5559,2019,https://image.tmdb.org/t/p/w500/d8qWh2q0VnMBJAH1LoR39v7JmeP.jpg,https://image.tmdb.org/t/p/original/sHQEhgjFPqdJi9a2uaYku8uM3wc.jpg,5.308,
Urchin,1283320,Harris Dickinson,"Frank Dillane, Megan Northam, Карина Химчук, Shonagh Marie, Amr Waked",Phim Chính Kịch,100,12.9416,2025,https://image.tmdb.org/t/p/w500/zc8n3hm3S2VxFxlNH1MNN28LVMa.jpg,https://image.tmdb.org/t/p/original/1M8MgXc9UifZFA8qeC2gG4UCQe.jpg,6.885,
Nhiệm Vụ: Bất Khả Thi - Nghiệp Báo Phần 1,575264,Christopher McQuarrie,"Tom Cruise, Hayley Atwell, Ving Rhames, Simon Pegg, Rebecca Ferguson","Phim Hành Động, Phim Gây Cấn",164,13.1634,2023,https://image.tmdb.org/t/p/w500/eoLBADTttXo4HJLLUK9amxE4RRM.jpg,https://image.tmdb.org/t/p/original/x1ZKRyvB7QAXfYVgf5mUJzjPqfH.jpg,7.518,Phần phim thứ 7 của loạt phim Nhiệm Vụ Bất Khả Thi
Chiếm Quyền,944864,Annemarie van de Mond,"Holly Mae Brood, Géza Weisz, Susan Radder, Frank Lammers, Noortje Herlaar","Phim Hành Động, Phim Hình Sự, Phim Gây Cấn",87,12.0667,2022,https://image.tmdb.org/t/p/w500/k3gGPN3TCXQCbnWY6SwxSE0LCxo.jpg,https://image.tmdb.org/t/p/original/cvOHMfZTxIiNI9yyjYgYfCpT48p.jpg,5.714,"Bị đổ tội giết người sau khi phát hiện ra vụ bê bối về quyền riêng tư, một tin tặc mũ trắng vừa trốn tránh cảnh sát vừa truy tìm bọn tội phạm đang đe dọa cô."
Homemade Christmas,744940,Adrian Langley,"Michelle Argyris, Travis Nelson, Connor McMahon, Margarita Valderrama, Tiara Johnny","Chương Trình Truyền Hình, Phim Lãng Mạn",80,13.4449,2020,https://image.tmdb.org/t/p/w500/tm2nvd5PsVmZOI4eeGt9nwbQ50t.jpg,https://image.tmdb.org/t/p/original/7jZWs3r7lCyUFc0VB53D5ezi1vg.jpg,5.8,
Chàng Will Tốt Bụng,489,Gus Van Sant,"Matt Damon, Robin Williams, Ben Affleck, Stellan Skarsgård, Minnie Driver",Phim Chính Kịch,127,12.212,1997,https://image.tmdb.org/t/p/w500/iRrgGkGg9q9pV6Hgg8fYU0nELJv.jpg,https://image.tmdb.org/t/p/original/bpV8wn48s82au37QyUJ51S7X2Vf.jpg,8.157,"Cậu bé Will Hunting bất hạnh lớn lên trong những xó xỉnh của Boston tham gia vào vô số những trò vô bổ: uống rượu, đánh nhau… Nhưng cậu lại là người thông minh và rất yêu khoa học. Cuộc đời Will đã rẽ sang ngả khác khi anh được nhận vào làm bảo vệ cho Học viện Công nghệ Massachusetts. Một lần vì tò mò Will nhìn trộm buổi học của lớp toán ứng dụng. Cậu đặc biệt thích thú với bài toán hóc búa của giáo sư Gerald Lambeau, Will đã giải nó ngay trong đêm.... Good Will Hunting là minh chứng hùng hồn cho quan điểm nhân tài có ở mọi nơi không kể xuất thân, địa vị, hoàn cảnh chỉ cần có cơ hội họ sẽ thể hiện được năng lực của mình. Qua câu chuyện của Will lại một lần nữa vai trò giáo dục của gia đình được nhấn mạnh nếu Will ..."
Deadly Hope,134197,Nicolas Monette,"Alana de la Garza, Sandrine Holt, Dan Jeannotte, Peter Michael Dillon, Vincent Leclerc","Phim Hình Sự, Phim Gây Cấn, Chương Trình Truyền Hình",86,11.9853,2012,https://image.tmdb.org/t/p/w500/xGkQoLpd2aQZXJzezV714kjogKm.jpg,https://image.tmdb.org/t/p/original/tp3fJGDQhxkyqLpVkfz8qU6DU1c.jpg,5.3,
Tàn phá,668489,Gareth Evans,"Tom Hardy, Jessie Mei Li, Timothy Olyphant, Forest Whitaker, Justin Cornwell","Phim Hành Động, Phim Hình Sự, Phim Gây Cấn",107,12.3182,2025,https://image.tmdb.org/t/p/w500/fghzFIe3vx6nbP2wkB6JE4cH50E.jpg,https://image.tmdb.org/t/p/original/7rKyFSg6SdLoCRCVoWLjL5k658k.jpg,6.399,"Khi vụ cướp ma túy vượt ngoài tầm kiểm soát, một cảnh sát chán chường chiến đấu giữa thế giới tội phạm ngầm ở thành phố thối nát để cứu con trai của một chính trị gia."
Ralph Đập Phá,82690,Rich Moore,"John C. Reilly, Sarah Silverman, Jack McBrayer, Alan Tudyk, Jane Lynch","Phim Gia Đình, Phim Hoạt Hình, Phim Hài, Phim Phiêu Lưu",101,12.4554,2012,https://image.tmdb.org/t/p/w500/phSig3M0vtzNPmnZQI9umtbMk0c.jpg,https://image.tmdb.org/t/p/original/riKyo85CmJU48ZaSMLpuDNTZHuE.jpg,7.352,"Ralph – anh chàng chuyên đóng vai kẻ ác trong trò chơi Fix - It Felix nổi tiếng, sau hàng thập kỷ lặp lại những công việc nhàm chán và phải làm nền cho Felix, Ralph quyết định rời bỏ trò chơi đã gắn bó 30 năm vào dấn thân vào cuộc phiêu lưu trong thế giới game, đi tìm chiếc huy chương vàng để chứng tỏ mình có những tố chất của một người hùng…  Thông qua câu chuyện của Ralph, phim đã mang đến một chân lý giản đơn dành cho tất cả mọi người: “Quan trọng không phải bạn tốt hay xấu, không phải bạn là ai, mà bạn sẽ làm gì cho cuộc sống”. Đặc biệt, với những ai từng say mê trò chơi điện tử , Wreck-It-Ralph sẽ giúp khán giả sống lại thời kỳ hoàng kim của những trò chơi điện tử bốn nút, máy chơi game bằng xèng có đồ họa đơn sơ năm xưa."
Fantom Morrisvillu,41981,Bořivoj Zeman,"Oldřich Nový, Květa Fialová, Jana Nováková, Vít Olmer, Waldemar Matuška","Phim Hài, Phim Bí Ẩn",89,11.4587,1966,https://image.tmdb.org/t/p/w500/hVhg406OSoYavpp7HTBNLJdjVef.jpg,https://image.tmdb.org/t/p/original/vIRFSvsgYcyvece6jkPEpocjHMH.jpg,6.85,
Surviving Christmas,15566,Mike Mitchell,"Ben Affleck, James Gandolfini, Christina Applegate, Catherine O'Hara, Josh Zuckerman","Phim Hài, Phim Lãng Mạn",91,12.2854,2004,https://image.tmdb.org/t/p/w500/8jHtvFpCOOqp2U2qwI3L3h10cUv.jpg,https://image.tmdb.org/t/p/original/7aRm8GSxrPhJK671kVADYgmJy7w.jpg,5.701,
Heavy Petting,33586,Marcel Sarmiento,"Malin Åkerman, Brendan Hines, Kevin Sussman, Mike Doyle, Juan Carlos Hernández","Phim Hài, Phim Lãng Mạn",92,11.434,2007,https://image.tmdb.org/t/p/w500/5m828dZSo4HAc6qo4Ksr7VxUIKx.jpg,https://image.tmdb.org/t/p/original/lI7Hcc1nZszERzdt6sVGe423g1r.jpg,4.222,
Murder at the Embassy,1310568,Stephen Shimek,"Mischa Barton, Richard Dillane, Mido Hamada, Antonia Bernath, Kojo Attah","Phim Bí Ẩn, Phim Gây Cấn, Phim Hành Động",90,10.0812,2025,https://image.tmdb.org/t/p/w500/3DBmBItPdy0A2ol59jgHhS54Lua.jpg,https://image.tmdb.org/t/p/original/gLXibzLQ4qegvjdqDC0f8yTij2P.jpg,5.9,
Kẻ Hủy Diệt,218,James Cameron,"Arnold Schwarzenegger, Michael Biehn, Linda Hamilton, Paul Winfield, Lance Henriksen","Phim Hành Động, Phim Gây Cấn, Phim Khoa Học Viễn Tưởng",108,11.7391,1984,https://image.tmdb.org/t/p/w500/dFci3DJsm1hNZbhFJNJ5XvssE5v.jpg,https://image.tmdb.org/t/p/original/ffdqHMWkh1h9MABwIfbfRJhgFW6.jpg,7.673,"Năm 2029, những kẻ cai trị Trái Đất quyết định gửi về quá khứ một robot sát thủ mang tên The Terminator - Kẻ Hủy Diệt để thay đổi quá khứ. Nhiệm vụ của tên robot này là giết chết Sarah Connor, người có vai trò quyết định trong cuộc kháng chiến của nhân loại sau này."
Audrey Rose,49126,Robert Wise,"Marsha Mason, Anthony Hopkins, John Beck, Susan Swift, Norman Lloyd","Phim Chính Kịch, Phim Kinh Dị, Phim Gây Cấn",113,10.7458,1977,https://image.tmdb.org/t/p/w500/omtHuaCwKRX20x5R8xnqxWYq8Xp.jpg,https://image.tmdb.org/t/p/original/9ylZRaHbbbVjaLCvTy7CfDbtu9w.jpg,5.6,
Dayo,1262599,Sidney Zaid Pascua,"Rica Gonzales, Marco Gomez, Audrey Avila, Calvin Reyes, Nathan Rojas",Phim Chính Kịch,112,11.7135,2024,https://image.tmdb.org/t/p/w500/JYgbVEMgW53uGVu2NvGJziCoTN.jpg,https://image.tmdb.org/t/p/original/AdqzORSUIeF072krXe8S2eWmRL9.jpg,4.4,
Waiting for the Wind,1442404,Don Schroeder,"Robert Mitchum, Rhonda Fleming, Jameson Parker, Zachary Bostrom, Fred Pinkard","Phim Chính Kịch, Phim Gia Đình",24,8.7906,1991,,,0.0,
Stormageddon,370097,Nick Lyon,"John Hennigan, Eve Mauro, Joseph Gatt, Robert Blanche, Ricco Ross","Phim Hành Động, Phim Chính Kịch, Phim Gây Cấn, Phim Khoa Học Viễn Tưởng",90,10.4377,2015,https://image.tmdb.org/t/p/w500/loZHFn4RoTeh4t1I4hS01DRYF7q.jpg,https://image.tmdb.org/t/p/original/wAvmYcjENgIBE3Bp8u0AO9gNmDQ.jpg,6.1,
Maladolescenza,46853,Pier Giuseppe Murgia,"Lara Wendel, Éva Ionesco, Martin Loeb",Phim Chính Kịch,94,12.7222,1977,https://image.tmdb.org/t/p/w500/nu5uj47KSF73VPEiIRYdPLJ96j7.jpg,https://image.tmdb.org/t/p/original/2AI3pSt5sbAEav6isVDIeCuiZql.jpg,5.131,
Kẻ Trộm Mặt Trăng,20352,Pierre Coffin,"Steve Carell, Jason Segel, Miranda Cosgrove, Dana Gaier, Elsie Fisher","Phim Gia Đình, Phim Hài, Phim Hoạt Hình, Phim Khoa Học Viễn Tưởng",95,11.385,2010,https://image.tmdb.org/t/p/w500/txfb1LyIEGJ69wTPJUiyufZVN4A.jpg,https://image.tmdb.org/t/p/original/2XSeKDmIa2KxaiJy4J9e8FrIZhk.jpg,7.254,"Nhân vật tâm điểm của bộ phim là Gru, một tên tội phạm khét tiếng. Gru và đám tay chân robot tí hon chuyên đi đánh cắp những biểu tượng nổi tiếng của thế giới. Thế nhưng tiếng xấu của Gru bị suy giảm khi tên tội phạm trẻ tuổi Vector đã ăn cắp kim tự tháp của Ai Cập. Gru quyết định làm phi vụ có một không hai cho thế giới phải bái phục: ăn cắp mặt trăng. Trước tiên, Gru phải đánh cắp khẩu súng có khả năng thu nhỏ mọi vật từ quân đội. Nhưng Vector đã nẫng tay trên khẩu súng thần kỳ từ Gru. Mọi kế hoạch giành lại cây súng của Gru đều bị Vector đánh bại. Cuối cùng, Gru nghĩ ra cách dùng ba đứa trẻ của viện mồ côi xâm nhập sào huyệt của Vector. Thế nhưng ba đứa trẻ Margo, Edith, Agnes đã cảm hóa Gru bằng sự ngây thơ, hướng thiện của mình."
