Tên phim,ID phim,Đạo diễn,Diễn viên chính,Thể loại phim,Thời lượng (phút),Độ phổ biến,Năm phát hành,Link Poster,Link Backdrop,Điểm đánh giá,Mô tả
"Biên Niên Sử Narnia: Sư Tử, Phù Thủy và Cái Tủ Áo",411,Andrew Adamson,"William Moseley, Anna Popplewell, Skandar Keynes, Georgie Henley, Liam Neeson","Phim Phiêu Lưu, Phim Gia Đình, Phim Giả Tượng",143,19.5562,2005,https://image.tmdb.org/t/p/w500/iREd0rNCjYdf5Ar0vfaW32yrkm.jpg,https://image.tmdb.org/t/p/original/AuV99eQivVWuk2AOSM6hYh9QRPQ.jpg,7.136,"Dựa theo cuốn tiểu thuyết của CS Lewis, 4 đứa trẻ tại Luân Đôn được gửi về nhà một vị giáo sư tại miền quê hoang vắng nhằm tránh khỏi cuộc thế chiến thứ 2. Trong một lần chơi trốn tìm, bọn trẻ đã khám phá ra một chiếc tủ áo, là cánh cửa dẫn đến một thế giới kỳ lạ mang tên Narnia, một vùng đất chịu sự cai quản của một mụ phù thuỷ độc ác. Để đánh bại mụ phù thủy, bọn trẻ phải gia nhập vào hàng ngũ của Aslan, vị thần sư tử của Narnia, và từ đây, một cuộc chiến đấu diễn ra giữa cái thiện và ác."
角頭－鬥陣欸,1468057,Jui-Chih Chiang,"Cao Tiệp, 蔡振南, 太保, 金介文, 龍天翔","Phim Hình Sự, Phim Hành Động",0,19.9023,2025,https://image.tmdb.org/t/p/w500/eoUcppppVNj8BkgBDkZTv82x3tx.jpg,https://image.tmdb.org/t/p/original/tm87rqU4zCiDIJKJDHmmhFSjXiX.jpg,7.0,
Young Hearts,1232449,Anthony Schatteman,"Lou Goossens, Marius De Saeger, Geert Van Rampelberg, Emilie De Roo, Dirk van Dijck","Phim Chính Kịch, Phim Lãng Mạn",99,18.2686,2024,https://image.tmdb.org/t/p/w500/xsApLXxqTG5uorAZRF0kJi0oXfR.jpg,https://image.tmdb.org/t/p/original/A7KwHKB5faRRRRveVQC5TPI35kV.jpg,8.474,
Fight Another Day,1053008,James Mark,"Jim Belushi, Martin Kove, Eric Johnson, Ennis Esmer, Chuck Liddell",Phim Hành Động,108,17.5697,2024,https://image.tmdb.org/t/p/w500/fKnLt1xQV0RdpN6RViowEiD1dFW.jpg,https://image.tmdb.org/t/p/original/znMUHotZRTcyIFWFz2bvcpSx6YP.jpg,5.053,
Nhiệm vụ biển xanh,286407,Robert Nixon,"James Cameron, Michael deGruy, Sylvia Earle, Bryce Groark, Jeremy Jackson",Phim Tài Liệu,94,14.9546,2014,https://image.tmdb.org/t/p/w500/34sR023uQt7gNMFWNIWRHaacrVc.jpg,https://image.tmdb.org/t/p/original/gkp83BnUbnXoZpIW5e6u9P6wFzd.jpg,7.42,Bộ phim tài liệu theo dấu nhà hải dương học Sylvia Earle trong chiến dịch cứu đại dương trên thế giới khỏi các mối đe dọa như đánh bắt quá mức và chất thải độc hại.
Laura's Toys,81467,Joseph W. Sarno,"Mary Mendum, Eric Edwards, Cathja Graff, Anita Ericsson, Anita Redling",Phim Chính Kịch,103,17.9181,1975,https://image.tmdb.org/t/p/w500/rqzupBGrChmHG5Wl6wy5vI0V3Vz.jpg,https://image.tmdb.org/t/p/original/dCz15Nt6MnVPBxBQwfGaGZPpEX2.jpg,4.824,
365 Ngày: Hôm Nay,829557,Tomasz Mandes,"Anna-Maria Sieklucka, Michele Morrone, Simone Susinna, Magdalena Lamparska, Otar Saralidze","Phim Lãng Mạn, Phim Chính Kịch",111,18.2238,2022,https://image.tmdb.org/t/p/w500/ee7qhbFyw4adAHgDTAELuiskkht.jpg,https://image.tmdb.org/t/p/original/zBG5Mg29NH9xxpWMMG7BIvKwYhL.jpg,5.9,Laura và Massimo trở lại và mạnh mẽ hơn bao giờ hết. Nhưng mối quan hệ gia đình của Massimo và một người đàn ông bí ẩn tán tỉnh Laura khiến cuộc sống của cặp đôi đảo lộn.
Người Nhện: Du Hành Vũ Trụ Nhện,569094,Kemp Powers,"Shameik Moore, Hailee Steinfeld, Brian Tyree Henry, Luna Lauren Vélez, Jake Johnson","Phim Hoạt Hình, Phim Hành Động, Phim Phiêu Lưu, Phim Khoa Học Viễn Tưởng",140,17.6466,2023,https://image.tmdb.org/t/p/w500/paM6UdMgXuXyAK0jhGfV07o3lRW.jpg,https://image.tmdb.org/t/p/original/9xfDWXAUbFXQK585JvByT5pEAhe.jpg,8.338,"Miles Morales tái xuất trong phần tiếp theo của bom tấn hoạt hình từng đoạt giải Oscar - Spider-Man: Across the Spider-Verse. Sau khi gặp lại Gwen Stacy, chàng Spider-Man thân thiện đến từ Brooklyn phải du hành qua đa vũ trụ và gặp một nhóm Người Nhện chịu trách nhiệm bảo vệ các thế giới song song. Nhưng khi nhóm siêu anh hùng xung đột về cách xử lý một mối đe dọa mới, Miles buộc phải đọ sức với các Người Nhện khác và phải xác định lại ý nghĩa của việc trở thành một người hùng để có thể cứu những người cậu yêu thương nhất."
Mufasa: Vua Sư Tử,762509,Barry Jenkins,"Aaron Pierre, Kelvin Harrison, Jr., Tiffany Boone, Kagiso Lediga, Preston Nyman","Phim Phiêu Lưu, Phim Gia Đình, Phim Hoạt Hình",118,18.3876,2024,https://image.tmdb.org/t/p/w500/k5w1IZ5EzR6qx4oXNAby0X3dqgU.jpg,https://image.tmdb.org/t/p/original/1w8kutrRucTd3wlYyu5QlUDMiG1.jpg,7.353,"Mufasa: Vua Sư Tử là phần tiền truyện của bộ phim hoạt hình Vua Sư Tử trứ danh, kể về cuộc đời của Mufasa - cha của Simba. Phim là hành trình Mufasa từ một chú sư tử mồ côi lạc đàn trở thành vị vua sư tử huyền thoại của Xứ Vua (Pride Land). Ngoài ra, quá khứ về tên phản diện Scar và hành trình hắc hóa của hắn cũng sẽ được phơi bày trong phần phim này."
Hành Tinh Cát,438631,Denis Villeneuve,"Timothée Chalamet, Rebecca Ferguson, Oscar Isaac, Jason Momoa, Stellan Skarsgård","Phim Khoa Học Viễn Tưởng, Phim Phiêu Lưu",155,18.56,2021,https://image.tmdb.org/t/p/w500/kZpP3t5wxOlHscZiDP3LuhuvkiI.jpg,https://image.tmdb.org/t/p/original/wYMbnrdRCREjNLwFlG5SLWzBjui.jpg,7.777,Là chuyến hành trình sử thi đầy cảm xúc của Paul Atreides – một chàng thanh niên trẻ tài ba xuất chúng được sinh ra với một sứ mệnh vĩ đại vượt ngoài tầm hiểu biết của chính bản thân anh. Paul đã phải du hành tới hành tinh nguy hiểm nhất trong Vũ trụ để đảm bảo được tương lai cho gia đình cũng như những người dân của anh ấy. Khi các thế lực tàn độc bắt đầu lao vào cuộc xung đột nhằm tranh giành độc quyền nguồn tài nguyên có giá trị nhất hành tinh – thứ nhiên liệu quý giá có khả năng kích hoạt những tiềm năng lớn nhất của nhân loại – chỉ những người chiến thắng được nỗi sợ hãi của mình mới có thể sống sót.
Bugso,1053630,Adolfo Alix Jr.,"Ayanna Misola, Sid Lucero, Hershie de Leon, Allan Paule, Lara Morena",Phim Chính Kịch,104,18.4638,2022,https://image.tmdb.org/t/p/w500/x6RRZRv1RKE83fgswIJ4fkuVbCE.jpg,https://image.tmdb.org/t/p/original/bXX3VcEuAPtXrhL4U6AlsTYv1zk.jpg,4.9,
Deadly Exposé,479366,Chris Jaymes,"Melissa Archer, Brandon Beemer, Alyshia Ochse, Graham Hamilton, Bryan Murphy",Phim Gây Cấn,87,17.9538,2017,https://image.tmdb.org/t/p/w500/2eDIw25dRxUf77CtiUvPIcAPMlh.jpg,https://image.tmdb.org/t/p/original/cAWU8SKzI5hWcrJEh9jPornESKj.jpg,4.9,
Lạc Trôi,823219,Gints Zilbalodis,Không rõ,"Phim Hoạt Hình, Phim Phiêu Lưu, Phim Giả Tượng, Phim Gia Đình",85,18.24,2024,https://image.tmdb.org/t/p/w500/s8nvGa3Dm4hvK6OHVQ6YGTjImjn.jpg,https://image.tmdb.org/t/p/original/ku9p7ciLeuV1R8pqJGMgawaaVE8.jpg,8.128,"Trước bối cảnh hậu tận thế, chú mèo xám nhút nhát, vốn luôn sợ nước phải rời bỏ vùng an toàn khi căn nhà thân yêu bị cuốn trôi bởi cơn lũ dữ. Trên hành trình vượt đại dương mênh mông, chú mèo cùng những người bạn đồng hành (Capybara, chó Labrador Retriever, Vượn Cáo, chim Thư ký) phải học cách vượt qua nỗi sợ và chấp nhận những điểm khác biệt để cùng nhau tồn tại."
Dead & Beautiful,660001,David Verbeek,"鍾瑤, Gijs Blom, Yen Tsao, Anechka Marchenko, Cheng-en Philip Juan",Phim Kinh Dị,98,18.272,2021,https://image.tmdb.org/t/p/w500/gGg8xjyK7w58kZsmfIQAN4keQ4n.jpg,https://image.tmdb.org/t/p/original/dtzXL7tKqOeB0rtURC9pCXsRiYm.jpg,3.5,
Harry Potter và Hoàng Tử Lai,767,David Yates,"Daniel Radcliffe, Rupert Grint, Emma Watson, Jim Broadbent, Michael Gambon","Phim Phiêu Lưu, Phim Giả Tượng",153,18.9626,2009,https://image.tmdb.org/t/p/w500/6YLJLaqxT6HHQeBMIWvcKpxS1Et.jpg,https://image.tmdb.org/t/p/original/iy0QpPxhmAhDjD8p7ukYHQB8HMh.jpg,7.682,"Đây là năm thứ 6 của Harry Potter tại trường Hogwarts. Trong lúc những thế lực hắc ám của Voldemort gieo rắc nỗi kinh hoàng và sợ hãi ở khắp nơi, mọi chuyện càng lúc càng trở nên rõ ràng hơn đối với Harry, cậu sẽ sớm phải đối diện với định mệnh của mình.  Draco Malfoy, kẻ thù không đội trời chung của Harry, có nhiều hành động khả nghi, luôn lén lút đi khắp trường. Vì thế, Harry cho rằng Draco là nội gián của Voldermort và quyết tâm tìm hiểu chính xác chuyện gì đang xảy ra..."
Cướp Biển Vùng Caribbean: Chiếc Rương Tử Thần,58,Gore Verbinski,"Johnny Depp, Orlando Bloom, Keira Knightley, Stellan Skarsgård, Bill Nighy","Phim Phiêu Lưu, Phim Giả Tượng, Phim Hành Động",151,18.6644,2006,https://image.tmdb.org/t/p/w500/6Ax7A0ngybY5LhG0M5gSfyjZV0I.jpg,https://image.tmdb.org/t/p/original/vr6n6ZFUZvedvIlhfYcbCWcaKyW.jpg,7.372,"Cuối cùng sau nhiều nỗ lực Jack Sparrow đã chiếm lại đuợc con tàu huyền thoại Ngọc Trai Đen. Tuy nhiên, để giành được Ngọc Trai Đen, Jack đã gây thù kết oán với Davy Jones (thuyền trưởng con tàu ma Flying Dutchman). Để chiến thắng Davy chỉ còn cách tìm được chiếc rương tử thần và Jack – Will – Elizabeth lại dấn thân vào cuộc phiêu lưu mới… Hình ảnh kì dị nhưng khá vui nhộn đã trở thành thương hiệu cho các phim do Walt Disney sản xuất. So với phần I phần II được lồng ghép thêm nhiều tình huống hài hước hơn. Các đại cảnh lớn được thiết kế công phu hoành tráng mang tới dấu ấn riêng."
Phim Super Mario Thiên Hà,1226863,Aaron Horvath,"Chris Pratt, Anya Taylor-Joy, Charlie Day, Jack Black, Keegan-Michael Key","Phim Gia Đình, Phim Giả Tượng, Phim Hài, Phim Phiêu Lưu, Phim Hoạt Hình",0,14.1847,2026,https://image.tmdb.org/t/p/w500/v3pKCzSpf0E7Wrx1c5kfetwGgC6.jpg,https://image.tmdb.org/t/p/original/cQ2BhusmYE5FOZZ66fjq9Jy3w9U.jpg,0.0,
Ma Trận,603,Lana Wachowski,"Keanu Reeves, Laurence Fishburne, Carrie-Anne Moss, Hugo Weaving, Gloria Foster","Phim Hành Động, Phim Khoa Học Viễn Tưởng",136,18.8441,1999,https://image.tmdb.org/t/p/w500/fE7S6EwaBgRQeqKoDVFoImMmAF4.jpg,https://image.tmdb.org/t/p/original/tlm8UkiQsitc8rSuIAscQDCnP8d.jpg,8.235,"The Matrix (MaTrận) là bộ phim khoa học giả tưởng về tương lai. Trong tương lai đó, Thomas, biệt danh Neo, là một hacker luôn có cảm giác khác thường về thế giới thực. Cho tới khi người đàn ông tự xưng là Morpheus tìm đến anh. Người đàn ông này nói cho anh biết, thế giới mà mọi người coi là thực chỉ là một chương trình giả lập để máy móc cai trị con người. Chỉ có một người có thể phá được Ma trận. Những người thật sống sót còn lại cuối cùng và những nhân viên Ma trận đều cùng đi tìm người đó. Và người đó chính là anh – Neo…"
Nguyên Thủ Đối Đầu,749170,Илья Найшуллер,"John Cena, Idris Elba, Priyanka Chopra Jonas, Paddy Considine, Carla Gugino","Phim Hành Động, Phim Gây Cấn, Phim Hài",117,20.8004,2025,https://image.tmdb.org/t/p/w500/lVgE5oLzf7ABmzyASEVcjYyHI41.jpg,https://image.tmdb.org/t/p/original/vJbEUMeI2AxBUZKjP6ZVeVNNTLh.jpg,6.87,"Hai nhà lãnh đạo – Tổng thống Mỹ (John Cena) và Thủ tướng Anh (Idris Elba) – bị rơi vào âm mưu khủng bố khi tham dự hội nghị NATO. Bị lạc ở Belarus, họ buộc phải bắt tay để sinh tồn, dù tính cách trái ngược. Cùng với đặc vụ MI6 (Priyanka Chopra), họ đối đầu kẻ thù quốc tế, qua chuỗi hành động–hài hước kịch tính xuyên châu Âu."
Chuyện Tào Lao,680,Quentin Tarantino,"John Travolta, Samuel L. Jackson, Uma Thurman, Bruce Willis, Ving Rhames","Phim Gây Cấn, Phim Hình Sự, Phim Hài",154,17.9371,1994,https://image.tmdb.org/t/p/w500/ihynkOAH6FLNgG1kqM5ep9GSHZS.jpg,https://image.tmdb.org/t/p/original/suaEOtk1N1sgg2MTM7oZd2cfVp3.jpg,8.488,"Những câu chuyện tưởng chừng tầm phào về 2 gã găng tơ trên đường thực hiện mệnh lệnh của ông chủ với 1 võ sĩ quyền anh giết chết người phải chạy trốn có vẻ không liên quan nhưng khi ghép lại người xem sẽ có 1 bức tranh tổng thể, đặc trưng cho phong cách của đạo diễn Quentin Tarantino: đậm chất bạo lực, máu me."
Captain America: Thế Giới Mới,822119,Julius Onah,"Anthony Mackie, Harrison Ford, Danny Ramirez, שירה האס, Tim Blake Nelson","Phim Hành Động, Phim Gây Cấn, Phim Khoa Học Viễn Tưởng",119,17.2313,2025,https://image.tmdb.org/t/p/w500/fWTZk4Y7HTyTTGNJnXNaX3XTE0v.jpg,https://image.tmdb.org/t/p/original/jhL4eTpccoZSVehhcR8DKLSBHZy.jpg,6.0,"Sau khi gặp Tổng thống Hoa Kỳ mới đắc cử Thaddeus Ross, Sam Wilson thấy mình bị cuốn vào một sự cố . Anh phải khám phá lý do đằng sau một âm mưu cực kì xấu xa trước khi kẻ chủ mưu thật sự khiến cả thế giới phải hoảng sợ"
Hoa Hồng Có Gai,1267905,Jay Roach,"Olivia Colman, Benedict Cumberbatch, Andy Samberg, Allison Janney, Belinda Bromilow","Phim Hài, Phim Chính Kịch, Phim Lãng Mạn",105,19.8409,2025,https://image.tmdb.org/t/p/w500/eGUlt6VzhSOk5tJ3lpSkDtLRsnJ.jpg,https://image.tmdb.org/t/p/original/h4HSZjOeAoHQ3qPuy6x9Cyr69bS.jpg,6.8,"Cuộc sống của Ivy và Theo tưởng chừng hoàn hảo: sự nghiệp thành công, hôn nhân hạnh phúc, con cái ngoan ngoãn. Nhưng đằng sau lớp vỏ của một gia đình lý tưởng ấy là cơn bão ngầm đang dần hình thành — khi sự nghiệp của Theo tuột dốc trong khi tham vọng của Ivy thăng hoa, thổi bùng lên ngọn lửa ganh đua và oán giận âm ỉ có thể"
Bhairavam,1388451,Vijay Kanakamedala,"Bellamkonda Srinivas, Manchu Manoj, Nara Rohith, Aditi Shankar, Anandhi","Phim Hành Động, Phim Hình Sự, Phim Gây Cấn",155,16.815,2025,https://image.tmdb.org/t/p/w500/pWImUye0RNPqtNl1G1RK6nFtYIt.jpg,https://image.tmdb.org/t/p/original/dpQu2WocTv0NMDdPLNwQiZJaOBX.jpg,3.0,
Mặt Nạ Xanh,854,Chuck Russell,"Jim Carrey, Peter Riegert, Peter Greene, Amy Yasbeck, Richard Jeni","Phim Lãng Mạn, Phim Hài, Phim Hình Sự, Phim Giả Tượng",101,15.1941,1994,https://image.tmdb.org/t/p/w500/jPC2eYub74zwf2tPGVtzSlBW6Oy.jpg,https://image.tmdb.org/t/p/original/80uHK2xWwjlOxmfJ1wQB09omAht.jpg,6.974,"Câu chuyện vui nhộn về anh chàng nhân viên ngân hàng Stanley Ipkiss nhút nhát, vụng về. Kể từ khi tình cờ tìm thấy chiếc mặt nạ của Chúa tể bóng đêm Loki, cuộc đời Ipkiss thay đổi hoàn toàn. Anh chàng có những khả năng siêu tưởng điên rồ như biến đổi cơ thể, bay nhảy lung tung, dọa nạt mọi người và nhiều câu chuyện hài hước khác…"
The Mission,1117644,Jesse Moss,"Pam Arlund, Dan Davis, Levi Davis, Daniel Everett, Lawrence Kao",Phim Tài Liệu,103,16.1699,2023,https://image.tmdb.org/t/p/w500/uGmeAMvTlgvziM2CVDhl9Dumwe5.jpg,https://image.tmdb.org/t/p/original/wcjlAaNE9pFK4Av5WBbDBmJ9Wc5.jpg,6.762,
Vợ chồng lão Twit,927254,Phil Johnston,"Margo Martindale, Johnny Vegas, Maitreyi Ramakrishnan, Ryan Anderson Lopez, Emilia Clarke","Phim Hoạt Hình, Phim Hài, Phim Gia Đình, Phim Giả Tượng",99,17.0404,2025,https://image.tmdb.org/t/p/w500/yc58ddSkwnn3Qe8jFFmv4qcgQOX.jpg,https://image.tmdb.org/t/p/original/i4o2aPGlnsxfPmDPF5lmlgjScyv.jpg,6.1,"Khi những kẻ xấu xa, độc ác nhất giở trò để chiếm lấy thị trấn, hai đứa trẻ dũng cảm bắt tay với một gia đình động vật biết phép thuật để lật đổ bọn họ."
L'ennui,55107,Cédric Kahn,"Charles Berling, Sophie Guillemin, Arielle Dombasle, Robert Kramer, Alice Grey","Phim Chính Kịch, Phim Lãng Mạn",122,14.8268,1998,https://image.tmdb.org/t/p/w500/9gUiZNEH3ZY2A2t0CGnCHTNKD6P.jpg,https://image.tmdb.org/t/p/original/qD3iptcv51gqYQiW4qPdwhyXN8A.jpg,5.2,
Lefter: Câu chuyện của Ordinarius,1386792,Can Ulkay,"Erdem Kaynarca, Aslıhan Malbora, Deniz Işın, Aslıhan Gürbüz, Halit Ergenç","Phim Chính Kịch, Phim Lịch Sử",0,14.4631,2025,https://image.tmdb.org/t/p/w500/pvy0dINISg6SIlRpzALX0p284lm.jpg,https://image.tmdb.org/t/p/original/8ECv9LSLwRnisxoTAmCZBBl8E6k.jpg,6.8,"Một thần đồng bóng đá vươn lên thành danh, chiến đấu với định kiến và những giằng xé nội tâm để chạm tới sự vĩ đại. Phim dựa trên cuộc đời của Lefter, huyền thoại của Thổ Nhĩ Kỳ."
Deadly Pickup,408567,Dean McKendrick,"Carter Cruise, Kira Noir, Billy Snow, William F. Bryant, Sarah Hunter",Phim Gây Cấn,81,17.8856,2016,https://image.tmdb.org/t/p/w500/kq0B2DAXRhauo3MACv8MKlliakW.jpg,https://image.tmdb.org/t/p/original/kGZDYsaRGu01nBOXgO1moa3mLL4.jpg,5.196,
Tình Yêu Có Bảo Đảm,644090,Mark Steven Johnson,"Rachael Leigh Cook, Damon Wayans Jr., Heather Graham, Caitlin Howden, Brendan Taylor","Phim Lãng Mạn, Phim Hài",90,12.2104,2020,https://image.tmdb.org/t/p/w500/6K22JB6fZZLBuM0knfl8rs9Zoxg.jpg,https://image.tmdb.org/t/p/original/i6X9J6AgGhR3FNTtEc5GRs9e3ya.jpg,6.386,
Phi Công Siêu Đẳng: Maverick,361743,Joseph Kosinski,"Tom Cruise, Val Kilmer, Miles Teller, Jennifer Connelly, Bashir Salahuddin","Phim Hành Động, Phim Chính Kịch",131,17.3189,2022,https://image.tmdb.org/t/p/w500/yuY9mNG8EgYBwDZKH4RFJHRoAUp.jpg,https://image.tmdb.org/t/p/original/AaV1YIdWKnjAIAOe8UUKBFm327v.jpg,8.165,"Sau hơn 30 năm phụng sự với tư cách phi công hàng đầu của hải quân, Pete “Maverick” Mitchell giờ đang làm việc mình yêu thích: bứt phá giới hạn trong vai trò một phi công thử nghiệm dũng cảm. Tuy nhiên, Maverick phải đối đầu với bóng ma quá khứ khi anh trở lại TOPGUN để đào tạo một nhóm học viên ưu tú và đối mặt với Trung úy Bradshaw, con trai của phi công yểm trợ cũ ""Goose"". Sự cạnh tranh gay gắt bùng nổ khi các phi công chuẩn bị cho một nhiệm vụ chuyên biệt đòi hỏi sự hy sinh tột bậc từ những người được chọn bay."
Time Addicts,1020094,Sam Odlum,"Freya Tingley, Charles Grounds, Joshua Morton, Elise Jansen","Phim Khoa Học Viễn Tưởng, Phim Hình Sự, Phim Gây Cấn",93,16.6341,2023,https://image.tmdb.org/t/p/w500/pTRfeB6TOupCpQ7lfTCYVE3Dzi.jpg,https://image.tmdb.org/t/p/original/5yw8tJFN34Rj7RETOqMZUjZa8RO.jpg,5.9,
Light of the World,1374686,Tom Bancroft,"Ian Hanlin, Benjamin Jacobson, Vincent Tong, Michael Benyaer, David Kaye","Phim Hoạt Hình, Phim Giả Tượng, Phim Chính Kịch, Phim Nhạc",84,16.4058,2025,https://image.tmdb.org/t/p/w500/3vUqo90FCIHXPiXnQJEeqzg5EDV.jpg,https://image.tmdb.org/t/p/original/xeIkV4e4joAmlRJhqJu2N8jR6zC.jpg,9.0,
Akin Ang Gabi,1580234,Joel Ferrer,"Queenie De Mesa, Trish Gaden, VR Relosa, Allen Legazpi, Claudia Enriquez",Phim Chính Kịch,70,21.4536,2025,https://image.tmdb.org/t/p/w500/oFqXF5GwmdFfLlv6bU98kT5hEes.jpg,https://image.tmdb.org/t/p/original/sihMx6NkKSptBWgFfQhNzYwHP79.jpg,0.0,
Icefall,1242501,Stefan Ruzowitzky,"Joel Kinnaman, Cara Jade Myers, Danny Huston, Graham Greene, Martin Sensmeier","Phim Hành Động, Phim Hình Sự, Phim Gây Cấn",99,17.609,2025,https://image.tmdb.org/t/p/w500/5Byv6nznAb2Izd0gHpODOXnuSbo.jpg,https://image.tmdb.org/t/p/original/gQimJqYMKCkwHIo8wwYKhmnCfBr.jpg,6.9,
Harry Potter và Mệnh Lệnh Phượng Hoàng,675,David Yates,"Daniel Radcliffe, Rupert Grint, Emma Watson, Imelda Staunton, Helena Bonham Carter","Phim Phiêu Lưu, Phim Giả Tượng",138,19.6422,2007,https://image.tmdb.org/t/p/w500/51WvjaatMgGZehizhtEGYD7p9kb.jpg,https://image.tmdb.org/t/p/original/jLbpgkxA5PSgzmcszT8yCOyPkgf.jpg,7.674,"Harry tức giận vì bị bỏ rơi ở nhà Dursley trong dịp hè, cậu ngờ rằng Chúa tể hắc ám Voldemort đang tập hợp lực lượng, và vì cậu có nguy cơ bị tấn công, những người Harry luôn coi là bạn đang cố che giấu tung tích cậu. Cuối cùng, sau khi được giải cứu, Harry khám phá ra rằng giáo sư Dumbledore đang tập hợp lại Hội Phượng Hoàng – một đoàn quân bí mật đã được thành lập từ những năm trước nhằm chống lại Chúa tể Voldemort.  Tuy nhiên, Bộ Pháp thuật không ủng hộ Hội Phượng Hoàng, những lời bịa đặt nhanh chóng được đăng tải trên Nhật báo Tiên tri – một tờ báo của giới phù thủy, Harry lo ngại rằng rất có khả năng cậu sẽ phải gánh vác trách nhiệm chống lại cái ác một mình."
Deadly Revenge,264760,Michael Feifer,"Alicia Ziegler, Mark Hapka, Donna Mills, Constance Wu, Patrick Muldoon","Phim Gây Cấn, Chương Trình Truyền Hình",92,18.1987,2013,https://image.tmdb.org/t/p/w500/x8AXM8BsfCW9rUwhMJkOXNbdON8.jpg,,3.857,
Venom: Kèo Cuối,912649,Kelly Marcel,"Tom Hardy, Chiwetel Ejiofor, Juno Temple, Rhys Ifans, Stephen Graham","Phim Hành Động, Phim Khoa Học Viễn Tưởng, Phim Phiêu Lưu",109,18.4777,2024,https://image.tmdb.org/t/p/w500/64hJDbJlLFJSRg4sG3njMCijIyF.jpg,https://image.tmdb.org/t/p/original/3V4kLQg0kSqPLctI5ziYWabAZYF.jpg,6.682,"Đây là phần phim cuối cùng và hoành tráng nhất về cặp đôi Venom và Eddie Brock (Tom Hardy). Sau khi dịch chuyển từ Vũ trụ Marvel trong ‘Spider-man: No way home’ (2021) trở về thực tại, Eddie Brock giờ đây cùng Venom sẽ phải đối mặt với ác thần Knull hùng mạnh - kẻ tạo ra cả chủng tộc Symbiote và những thế lực đang rình rập khác. Cặp đôi Eddie và Venom sẽ phải đưa ra lựa quyết định khốc liệt để hạ màn kèo cuối này."
Nữ Quái Xế,1151334,Shawn Simmons,"Samara Weaving, Karl Glusman, Andy Garcia, Steve Zahn, Jermaine Fowler","Phim Gây Cấn, Phim Hành Động, Phim Hài",106,17.9942,2025,https://image.tmdb.org/t/p/w500/12Va3oO3oYUdOd75zM57Nx1976a.jpg,https://image.tmdb.org/t/p/original/8jeDyvFQKgss36FbGAmGQVzPXlH.jpg,6.362,"Ngày xưa, cô từng là tay lái bỏ trốn tuổi teen lẫy lừng. Giờ đây, khi tưởng đã chôn vùi quá khứ tội lỗi, cô lại bị kéo trở lại thế giới ngầm. Một ông chủ cũ xuất hiện, đưa ra lời đề nghị: cứu lấy mạng sống của gã bạn trai cũ — kẻ vừa quen thuộc, vừa nguy hiểm, nhưng chưa bao giờ biết giữ chữ tín. Trước ngã rẽ sinh tử, cô buộc phải tăng tốc lần nữa, không chỉ để thoát hiểm, mà còn để quyết định liệu tình yêu cũ có xứng đáng với một cú lái định mệnh."
Sisu: Già Gân Báo Thù,840326,Jalmari Helander,"Jorma Tommila, Aksel Hennie, Jack Doolan, Mimosa Willamo, Onni Tommila","Phim Hành Động, Phim Chiến Tranh",91,19.9326,2022,https://image.tmdb.org/t/p/w500/bUnhv3lAxVbXnPJ0N9fLVQ3m0zl.jpg,https://image.tmdb.org/t/p/original/pBdQ4iorzRV2G38mdS6rzrmUfMA.jpg,7.396,"Khi một cựu quân nhân phát hiện ra vàng ở vùng hoang dã Lapland cố gắng mang chiến lợi phẩm vào thành phố, những người lính Đức Quốc xã do một sĩ quan SS tàn bạo chỉ huy đã chiến đấu với anh ta."
Sisu: Già Gân Báo Thù,840326,Jalmari Helander,"Jorma Tommila, Aksel Hennie, Jack Doolan, Mimosa Willamo, Onni Tommila","Phim Hành Động, Phim Chiến Tranh",91,19.9326,2022,https://image.tmdb.org/t/p/w500/bUnhv3lAxVbXnPJ0N9fLVQ3m0zl.jpg,https://image.tmdb.org/t/p/original/pBdQ4iorzRV2G38mdS6rzrmUfMA.jpg,7.396,"Khi một cựu quân nhân phát hiện ra vàng ở vùng hoang dã Lapland cố gắng mang chiến lợi phẩm vào thành phố, những người lính Đức Quốc xã do một sĩ quan SS tàn bạo chỉ huy đã chiến đấu với anh ta."
Sàn Đấu Sinh Tử,550,David Fincher,"Edward Norton, Brad Pitt, Helena Bonham Carter, Meat Loaf, Jared Leto","Phim Chính Kịch, Phim Gây Cấn",139,17.5412,1999,https://image.tmdb.org/t/p/w500/wBxkCbNI8eDRRfUEl8w0G2rfLyu.jpg,https://image.tmdb.org/t/p/original/hZkgoQYus5vegHoetLkCJzb17zJ.jpg,8.438,"Cuộc gặp gỡ định mệnh của một nhân viên giám định bảo hiểm và một gã lông bông bán xà phòng trên chuyến bay đã mở ra một cuộc phiêu lưu kỳ lạ. Với các ""câu lạc bộ chiến đấu"" ngầm hình thành ở mọi thị trấn, cuốn theo nhiều diễn biến phức tạp và một cái kết đầy kịch tính."
रामायण,656908,Nitesh Tiwari,"Ranbir Kapoor, Sai Pallavi, Ravi Dubey, Yash, Sunny Deol","Phim Hành Động, Phim Chính Kịch, Phim Giả Tượng",0,16.0441,2026,https://image.tmdb.org/t/p/w500/lS17squIY8OpyFJz3cOCFzYxNUA.jpg,https://image.tmdb.org/t/p/original/in5hdAhBrI4lMnVlK0Bx45rJu5g.jpg,0.0,
